{
  "baseCase": {
    "purchasePrice": 32000000,
    "totalBasis": 34960000,
    "goingInCapRate": 0.0528,
    "stabilizedCapRate": 0.0686,
    "year1NOI": 1688500,
    "stabilizedNOI": 2400000,
    "leveragedIRR": 0.0963,
    "equityMultiple": 1.547,
    "cashOnCash": -0.0086,
    "equityRequired": 10960000,
    "debtRequest": 24000000,
    "targetLTV": 0.75,
    "targetDSCR": 0.947
  },
  "scenarioSummary": {
    "baseIRR": 0.0963,
    "worstIRR": 0.0284,
    "bestIRR": 0.1584,
    "medianIRR": 0.0963,
    "passRate": 0.037,
    "dscrRange": {
      "min": 1.039,
      "max": 1.126
    }
  },
  "debtSizing": {
    "requestedLoanAmount": 24000000,
    "maxLTV": 0.75,
    "constrainingMetric": "DSCR",
    "interestRate": 0.063,
    "term": 10,
    "amortization": 30,
    "ioPeriod": 2
  },
  "capExBudget": {
    "total5Year": 2400000,
    "yearlySchedule": [
      800000,
      440000,
      320000,
      240000,
      200000
    ],
    "immediateNeeds": 680000
  },
  "proForma": [
    {
      "year": 1,
      "revenue": 3414000,
      "expenses": 1725500,
      "noi": 1688500,
      "debtService": 1560000,
      "dscr": 1.082,
      "cashFlow": 128500
    },
    {
      "year": 2,
      "revenue": 3516420,
      "expenses": 1766912,
      "noi": 2079825,
      "debtService": 1560000,
      "dscr": 1.333,
      "cashFlow": 519825
    },
    {
      "year": 3,
      "revenue": 3621913,
      "expenses": 1809318,
      "noi": 2400000,
      "debtService": 1820356,
      "dscr": 1.318,
      "cashFlow": 579644
    },
    {
      "year": 4,
      "revenue": 3730570,
      "expenses": 1852742,
      "noi": 2460000,
      "debtService": 1820356,
      "dscr": 1.351,
      "cashFlow": 639644
    },
    {
      "year": 5,
      "revenue": 3842487,
      "expenses": 1897207,
      "noi": 2521500,
      "debtService": 1820356,
      "dscr": 1.385,
      "cashFlow": 701144
    },
    {
      "year": 6,
      "revenue": 3957762,
      "expenses": 1942740,
      "noi": 2584537,
      "debtService": 1820356,
      "dscr": 1.42,
      "cashFlow": 764182
    },
    {
      "year": 7,
      "revenue": 4076495,
      "expenses": 1989366,
      "noi": 2649151,
      "debtService": 1820356,
      "dscr": 1.455,
      "cashFlow": 828795
    },
    {
      "year": 8,
      "revenue": 4198789,
      "expenses": 2037111,
      "noi": 2715380,
      "debtService": 1820356,
      "dscr": 1.492,
      "cashFlow": 895024
    },
    {
      "year": 9,
      "revenue": 4324753,
      "expenses": 2086002,
      "noi": 2783264,
      "debtService": 1820356,
      "dscr": 1.529,
      "cashFlow": 962908
    },
    {
      "year": 10,
      "revenue": 4454496,
      "expenses": 2136066,
      "noi": 2852846,
      "debtService": 1820356,
      "dscr": 1.567,
      "cashFlow": 1032490
    }
  ],
  "proFormaAssumptions": "Revenue growth 3.2%, expense growth 2.4%, exit cap 6.50%.",
  "returnMetrics": [
    {
      "metric": "Leveraged IRR",
      "value": "9.6%",
      "target": "15%"
    },
    {
      "metric": "Equity Multiple",
      "value": "1.55x",
      "target": "1.8x"
    },
    {
      "metric": "Cash-on-Cash",
      "value": "-0.9%",
      "target": "8%"
    }
  ],
  "exitAnalysis": {
    "holdYears": 5,
    "exitCapRate": 0.065,
    "exitNOI": 2584537,
    "grossExitValue": 39762115,
    "netSaleProceeds": 17648062
  },
  "scenarioMatrix": [
    {
      "scenario": "RENT_DOWN_VACANCY_HIGH_EXIT_TIGHT",
      "rentCase": "Downside rent",
      "vacancyCase": "High vacancy",
      "exitCapCase": "Exit cap tightens 50 bps",
      "rentShock": -0.02,
      "vacancyShock": -0.02,
      "exitCapRate": 0.0625,
      "probability": 0.015625,
      "irr": 0.1073,
      "equityMultiple": 1.632,
      "dscr": 1.039,
      "exitValue": 39698496,
      "pass": false
    },
    {
      "scenario": "RENT_DOWN_VACANCY_HIGH_EXIT_BASE",
      "rentCase": "Downside rent",
      "vacancyCase": "High vacancy",
      "exitCapCase": "Base exit cap",
      "rentShock": -0.02,
      "vacancyShock": -0.02,
      "exitCapRate": 0.0675,
      "probability": 0.03125,
      "irr": 0.0679,
      "equityMultiple": 1.369,
      "dscr": 1.039,
      "exitValue": 36757867,
      "pass": false
    },
    {
      "scenario": "RENT_DOWN_VACANCY_HIGH_EXIT_WIDE",
      "rentCase": "Downside rent",
      "vacancyCase": "High vacancy",
      "exitCapCase": "Exit cap widens 50 bps",
      "rentShock": -0.02,
      "vacancyShock": -0.02,
      "exitCapRate": 0.07250000000000001,
      "probability": 0.015625,
      "irr": 0.0284,
      "equityMultiple": 1.142,
      "dscr": 1.039,
      "exitValue": 34222841,
      "pass": false
    },
    {
      "scenario": "RENT_DOWN_VACANCY_BASE_EXIT_TIGHT",
      "rentCase": "Downside rent",
      "vacancyCase": "Base vacancy",
      "exitCapCase": "Exit cap tightens 50 bps",
      "rentShock": -0.02,
      "vacancyShock": 0,
      "exitCapRate": 0.0625,
      "probability": 0.03125,
      "irr": 0.1207,
      "equityMultiple": 1.726,
      "dscr": 1.061,
      "exitValue": 40525548,
      "pass": false
    },
    {
      "scenario": "RENT_DOWN_VACANCY_BASE_EXIT_BASE",
      "rentCase": "Downside rent",
      "vacancyCase": "Base vacancy",
      "exitCapCase": "Base exit cap",
      "rentShock": -0.02,
      "vacancyShock": 0,
      "exitCapRate": 0.0675,
      "probability": 0.0625,
      "irr": 0.0824,
      "equityMultiple": 1.458,
      "dscr": 1.061,
      "exitValue": 37523656,
      "pass": false
    },
    {
      "scenario": "RENT_DOWN_VACANCY_BASE_EXIT_WIDE",
      "rentCase": "Downside rent",
      "vacancyCase": "Base vacancy",
      "exitCapCase": "Exit cap widens 50 bps",
      "rentShock": -0.02,
      "vacancyShock": 0,
      "exitCapRate": 0.07250000000000001,
      "probability": 0.03125,
      "irr": 0.0441,
      "equityMultiple": 1.227,
      "dscr": 1.061,
      "exitValue": 34935817,
      "pass": false
    },
    {
      "scenario": "RENT_DOWN_VACANCY_LOW_EXIT_TIGHT",
      "rentCase": "Downside rent",
      "vacancyCase": "Low vacancy",
      "exitCapCase": "Exit cap tightens 50 bps",
      "rentShock": -0.02,
      "vacancyShock": 0.02,
      "exitCapRate": 0.0625,
      "probability": 0.015625,
      "irr": 0.1337,
      "equityMultiple": 1.821,
      "dscr": 1.082,
      "exitValue": 41352600,
      "pass": false
    },
    {
      "scenario": "RENT_DOWN_VACANCY_LOW_EXIT_BASE",
      "rentCase": "Downside rent",
      "vacancyCase": "Low vacancy",
      "exitCapCase": "Base exit cap",
      "rentShock": -0.02,
      "vacancyShock": 0.02,
      "exitCapRate": 0.0675,
      "probability": 0.03125,
      "irr": 0.0963,
      "equityMultiple": 1.547,
      "dscr": 1.082,
      "exitValue": 38289444,
      "pass": false
    },
    {
      "scenario": "RENT_DOWN_VACANCY_LOW_EXIT_WIDE",
      "rentCase": "Downside rent",
      "vacancyCase": "Low vacancy",
      "exitCapCase": "Exit cap widens 50 bps",
      "rentShock": -0.02,
      "vacancyShock": 0.02,
      "exitCapRate": 0.07250000000000001,
      "probability": 0.015625,
      "irr": 0.0591,
      "equityMultiple": 1.311,
      "dscr": 1.082,
      "exitValue": 35648793,
      "pass": false
    },
    {
      "scenario": "RENT_BASE_VACANCY_HIGH_EXIT_TIGHT",
      "rentCase": "Base rent",
      "vacancyCase": "High vacancy",
      "exitCapCase": "Exit cap tightens 50 bps",
      "rentShock": 0,
      "vacancyShock": -0.02,
      "exitCapRate": 0.0625,
      "probability": 0.03125,
      "irr": 0.1207,
      "equityMultiple": 1.726,
      "dscr": 1.061,
      "exitValue": 40525548,
      "pass": false
    },
    {
      "scenario": "RENT_BASE_VACANCY_HIGH_EXIT_BASE",
      "rentCase": "Base rent",
      "vacancyCase": "High vacancy",
      "exitCapCase": "Base exit cap",
      "rentShock": 0,
      "vacancyShock": -0.02,
      "exitCapRate": 0.0675,
      "probability": 0.0625,
      "irr": 0.0824,
      "equityMultiple": 1.458,
      "dscr": 1.061,
      "exitValue": 37523656,
      "pass": false
    },
    {
      "scenario": "RENT_BASE_VACANCY_HIGH_EXIT_WIDE",
      "rentCase": "Base rent",
      "vacancyCase": "High vacancy",
      "exitCapCase": "Exit cap widens 50 bps",
      "rentShock": 0,
      "vacancyShock": -0.02,
      "exitCapRate": 0.07250000000000001,
      "probability": 0.03125,
      "irr": 0.0441,
      "equityMultiple": 1.227,
      "dscr": 1.061,
      "exitValue": 34935817,
      "pass": false
    },
    {
      "scenario": "RENT_BASE_VACANCY_BASE_EXIT_TIGHT",
      "rentCase": "Base rent",
      "vacancyCase": "Base vacancy",
      "exitCapCase": "Exit cap tightens 50 bps",
      "rentShock": 0,
      "vacancyShock": 0,
      "exitCapRate": 0.0625,
      "probability": 0.0625,
      "irr": 0.1337,
      "equityMultiple": 1.821,
      "dscr": 1.082,
      "exitValue": 41352600,
      "pass": false
    },
    {
      "scenario": "RENT_BASE_VACANCY_BASE_EXIT_BASE",
      "rentCase": "Base rent",
      "vacancyCase": "Base vacancy",
      "exitCapCase": "Base exit cap",
      "rentShock": 0,
      "vacancyShock": 0,
      "exitCapRate": 0.0675,
      "probability": 0.125,
      "irr": 0.0963,
      "equityMultiple": 1.547,
      "dscr": 1.082,
      "exitValue": 38289444,
      "pass": false
    },
    {
      "scenario": "RENT_BASE_VACANCY_BASE_EXIT_WIDE",
      "rentCase": "Base rent",
      "vacancyCase": "Base vacancy",
      "exitCapCase": "Exit cap widens 50 bps",
      "rentShock": 0,
      "vacancyShock": 0,
      "exitCapRate": 0.07250000000000001,
      "probability": 0.0625,
      "irr": 0.0591,
      "equityMultiple": 1.311,
      "dscr": 1.082,
      "exitValue": 35648793,
      "pass": false
    },
    {
      "scenario": "RENT_BASE_VACANCY_LOW_EXIT_TIGHT",
      "rentCase": "Base rent",
      "vacancyCase": "Low vacancy",
      "exitCapCase": "Exit cap tightens 50 bps",
      "rentShock": 0,
      "vacancyShock": 0.02,
      "exitCapRate": 0.0625,
      "probability": 0.03125,
      "irr": 0.1463,
      "equityMultiple": 1.915,